[
  {
    "claim_id": "CLM-DEMO-10000",
    "synthetic": true,
    "data_source": "call-center-demo-synth-v1",
    "member_id": "MBR-DEMO-000101",
    "provider_id": "PRV-DEMO-2002",
    "date_of_service": "2026-02-10",
    "status": "PAID",
    "denial_reason_code": null,
    "denial_reason_text": null,
    "billed_amount": 220.0,
    "allowed_amount": 180.0,
    "member_responsibility": 25.0,
    "service_description": "Physical therapy session",
    "appeal_deadline": null,
    "appeal_status": null
  },
  {
    "claim_id": "CLM-DEMO-10001",
    "synthetic": true,
    "data_source": "call-center-demo-synth-v1",
    "member_id": "MBR-DEMO-000102",
    "provider_id": "PRV-DEMO-2003",
    "date_of_service": "2026-03-11",
    "status": "PAID",
    "denial_reason_code": null,
    "denial_reason_text": null,
    "billed_amount": 235.0,
    "allowed_amount": 192.0,
    "member_responsibility": 28.0,
    "service_description": "Lab panel",
    "appeal_deadline": null,
    "appeal_status": null
  },
  {
    "claim_id": "CLM-DEMO-10002",
    "synthetic": true,
    "data_source": "call-center-demo-synth-v1",
    "member_id": "MBR-DEMO-000103",
    "provider_id": "PRV-DEMO-2004",
    "date_of_service": "2026-04-12",
    "status": "PAID",
    "denial_reason_code": null,
    "denial_reason_text": null,
    "billed_amount": 250.0,
    "allowed_amount": 204.0,
    "member_responsibility": 31.0,
    "service_description": "Annual wellness visit",
    "appeal_deadline": null,
    "appeal_status": null
  },
  {
    "claim_id": "CLM-DEMO-10003",
    "synthetic": true,
    "data_source": "call-center-demo-synth-v1",
    "member_id": "MBR-DEMO-000104",
    "provider_id": "PRV-DEMO-2005",
    "date_of_service": "2026-05-13",
    "status": "PAID",
    "denial_reason_code": null,
    "denial_reason_text": null,
    "billed_amount": 265.0,
    "allowed_amount": 216.0,
    "member_responsibility": 34.0,
    "service_description": "Follow-up consultation",
    "appeal_deadline": null,
    "appeal_status": null
  },
  {
    "claim_id": "CLM-DEMO-10004",
    "synthetic": true,
    "data_source": "call-center-demo-synth-v1",
    "member_id": "MBR-DEMO-000105",
    "provider_id": "PRV-DEMO-2006",
    "date_of_service": "2026-06-14",
    "status": "PAID",
    "denial_reason_code": null,
    "denial_reason_text": null,
    "billed_amount": 280.0,
    "allowed_amount": 228.0,
    "member_responsibility": 37.0,
    "service_description": "Lab panel",
    "appeal_deadline": null,
    "appeal_status": null
  },
  {
    "claim_id": "CLM-DEMO-10005",
    "synthetic": true,
    "data_source": "call-center-demo-synth-v1",
    "member_id": "MBR-DEMO-000106",
    "provider_id": "PRV-DEMO-2007",
    "date_of_service": "2026-06-02",
    "status": "DENIED",
    "denial_reason_code": "CO-197",
    "denial_reason_text": "Precertification/authorization absent",
    "billed_amount": 480.0,
    "allowed_amount": 0.0,
    "member_responsibility": 480.0,
    "service_description": "Specialist consultation",
    "appeal_deadline": "2026-09-30",
    "appeal_status": "NOT_FILED"
  },
  {
    "claim_id": "CLM-DEMO-10006",
    "synthetic": true,
    "data_source": "call-center-demo-synth-v1",
    "member_id": "MBR-DEMO-000107",
    "provider_id": "PRV-DEMO-2008",
    "date_of_service": "2026-06-02",
    "status": "DENIED",
    "denial_reason_code": "CO-B7",
    "denial_reason_text": "Provider not certified/eligible to bill for this service (out-of-network)",
    "billed_amount": 480.0,
    "allowed_amount": 0.0,
    "member_responsibility": 480.0,
    "service_description": "Specialist consultation",
    "appeal_deadline": "2026-10-15",
    "appeal_status": "NOT_FILED"
  },
  {
    "claim_id": "CLM-DEMO-10007",
    "synthetic": true,
    "data_source": "call-center-demo-synth-v1",
    "member_id": "MBR-DEMO-000108",
    "provider_id": "PRV-DEMO-2009",
    "date_of_service": "2026-06-02",
    "status": "DENIED",
    "denial_reason_code": "CO-96",
    "denial_reason_text": "Non-covered charge under member's current plan",
    "billed_amount": 480.0,
    "allowed_amount": 0.0,
    "member_responsibility": 480.0,
    "service_description": "Specialist consultation",
    "appeal_deadline": "2026-10-05",
    "appeal_status": "NOT_FILED"
  },
  {
    "claim_id": "CLM-DEMO-10008",
    "synthetic": true,
    "data_source": "call-center-demo-synth-v1",
    "member_id": "MBR-DEMO-000109",
    "provider_id": "PRV-DEMO-2001",
    "date_of_service": "2026-08-20",
    "status": "IN_REVIEW",
    "denial_reason_code": null,
    "denial_reason_text": null,
    "billed_amount": 610.0,
    "allowed_amount": null,
    "member_responsibility": null,
    "service_description": "Outpatient procedure",
    "appeal_deadline": null,
    "appeal_status": null
  },
  {
    "claim_id": "CLM-DEMO-10009",
    "synthetic": true,
    "data_source": "call-center-demo-synth-v1",
    "member_id": "MBR-DEMO-000110",
    "provider_id": "PRV-DEMO-2002",
    "date_of_service": "2026-08-20",
    "status": "IN_REVIEW",
    "denial_reason_code": null,
    "denial_reason_text": null,
    "billed_amount": 610.0,
    "allowed_amount": null,
    "member_responsibility": null,
    "service_description": "Outpatient procedure",
    "appeal_deadline": null,
    "appeal_status": null
  },
  {
    "claim_id": "CLM-DEMO-10010",
    "synthetic": true,
    "data_source": "call-center-demo-synth-v1",
    "member_id": "MBR-DEMO-000111",
    "provider_id": "PRV-DEMO-2003",
    "date_of_service": "2026-05-10",
    "status": "PAID",
    "denial_reason_code": null,
    "denial_reason_text": null,
    "billed_amount": 150.0,
    "allowed_amount": 120.0,
    "member_responsibility": 15.0,
    "service_description": "Office visit",
    "appeal_deadline": null,
    "appeal_status": null
  },
  {
    "claim_id": "CLM-DEMO-10011",
    "synthetic": true,
    "data_source": "call-center-demo-synth-v1",
    "member_id": "MBR-DEMO-000111",
    "provider_id": "PRV-DEMO-2003",
    "date_of_service": "2026-07-22",
    "status": "DENIED",
    "denial_reason_code": "CO-96",
    "denial_reason_text": "Non-covered charge under member's current plan",
    "billed_amount": 340.0,
    "allowed_amount": 0.0,
    "member_responsibility": 340.0,
    "service_description": "Imaging (MRI)",
    "appeal_deadline": "2026-11-01",
    "appeal_status": "NOT_FILED"
  },
  {
    "claim_id": "CLM-DEMO-10012",
    "synthetic": true,
    "data_source": "call-center-demo-synth-v1",
    "member_id": "MBR-DEMO-000112",
    "provider_id": "PRV-DEMO-2004",
    "date_of_service": "2026-05-10",
    "status": "PAID",
    "denial_reason_code": null,
    "denial_reason_text": null,
    "billed_amount": 150.0,
    "allowed_amount": 120.0,
    "member_responsibility": 15.0,
    "service_description": "Office visit",
    "appeal_deadline": null,
    "appeal_status": null
  },
  {
    "claim_id": "CLM-DEMO-10013",
    "synthetic": true,
    "data_source": "call-center-demo-synth-v1",
    "member_id": "MBR-DEMO-000112",
    "provider_id": "PRV-DEMO-2004",
    "date_of_service": "2026-07-22",
    "status": "DENIED",
    "denial_reason_code": "CO-96",
    "denial_reason_text": "Non-covered charge under member's current plan",
    "billed_amount": 340.0,
    "allowed_amount": 0.0,
    "member_responsibility": 340.0,
    "service_description": "Imaging (MRI)",
    "appeal_deadline": "2026-11-01",
    "appeal_status": "NOT_FILED"
  }
]
